ID;FILE
59;Suporte do patrocinador: seu patrocinador realmente acredita no projeto, ou alguém designou ele com a missão de fazer o projeto acontecer, mas ele não está muito interessado, tem outras prioridades? Não ter total apoio do patrocinador é um péssimo sinal de dias ruins, como ter algum recurso chave do seu projeto cortado sem aviso prévio. É fundamental que o patrocinador conheça, acredite e priorize o projeto dentro da organização.
60;Envolvimento dos interessados: este item está de certa forma relacionado a falta de suporte do patrocinador. Em grandes empresas todos estão sempre muito ocupados. Se o projeto não é prioridade, as partes interessadas não vão se envolver. Se eles não vêm valor no projeto, também não vão se envolver. No capítulo de recursos humanos falamos sobre a importância da evangelização das partes interessadas sobre aspectos de B&A e especificamente do projeto em andamento.
61;Metas de projeto: falamos em seção anterior que um projeto de sucesso não é apenas aquele que entrega o projeto com mínima variação de prazo, com o escopo acordado e com os custos previstos. Mas claro, isso também é um fator de sucesso! Falamos que entregar no prazo, custo e escopo não adianta se não entregar valor. Mas pense a situação contrária, o projeto entregou valor mas levou 18 meses a mais do que o planejado! Uma das funções mais importantes do gerente de projeto é manter o controle, para que, quando necessário, as medidas corretivas sejam tomadas para evitar um dano maior ao projeto. Se tivesse que resumir gerencia de projetos em uma única palavra, a palavra seria CONTROLE.
62;Orientado a negócio e não a tecnologia: infelizmente muitos projetos nascem orientados a tecnologia. Se as tecnologias estão de acordo com o que se quer construir, tudo bem, porém, se forem sub ou superestimadas, poderão levar o projeto ao fracasso. E acredite, isso acontece todo o dia! Um projeto de B&A deve antes de tudo avaliar o que se quer produzir, qual o seu objetivo. Tendo isso claro, então se avaliam as tecnologias existentes.
63;Vamos falar posteriormente em análise de protótipos e pilotos, quando o projeto será analisado mais profundamente do ponto de vista de arquitetura. Mas, incialmente, alguns aspectos devem ser analisados com a equipe do projeto, como arquitetos, programadores e o pessoal de infraestrutura: qual vai ser o volume de dados? Muitas questões estão relacionadas com o volume: quantas serão as transações por minuto? Qual o volume de dados diário e mensal em terabytes ou pentabytes? Quantos datanodes e namenodes serão necessários? É preciso analisar o crescimento do sistema para os próximos anos (pelo menos para os próximos 3 anos) e avaliar a infraestrutura necessária quanto a armazenamento, rede e processamento.
64;Analisando agora outro “V” de Big Data, temos que analisar o aspecto da velocidade dos dados, não só na sua origem, mas de qual a latência possível até sua análise concluída. Serão dados em fluxo (streaming) analisados em memória ou informação estática? São dados em tempo real, próximo ao tempo real, ou com baixa latência (dias, semanas, meses)? Dados em tempo real podem ter um requisito de milissegundos, segundos, minutos ou mesmo horas. Já falamos sobre o valor da informação: talvez um indicativo de fraude deve ser reportado em segundos. Uma auditoria de folha de pagamento pode ser processada em 30 dias! Em certos casos você terá que considerar por exemplo, infraestrutura de rede de 10 gigabit Ethernet para suportar o streaming. Spark, irmão do Hadoop, é uma excelente plataforma de processamento em memória para projetos de tempo real ou próximo ao tempo real. Hoje, um servidor com 6 TB de memória pode suportar grandes volumes de dados e custar muito menos do que vários computadores “comódite” que comporiam alguns nós de um cluster.
65;Outro grande impacto no projeto é com relação a variedade. Serão dados estruturados ou não estruturados? Quais serão os fornecedores? Que tipo de dados não estruturado serão? Imagens, vídeos, e-mails? Estão em plataforma baixa ou alta? Existem conectores conhecidos e funcionais para todas as fontes? Existem dados criptografados ou em formatos proprietários? Existem dados gerados por máquinas? Serão necessários dados de dispositivos? Redes sociais? Será preciso comprar algum tipo de dados de um data broker[1]? As fontes de dados estão documentadas? Para piorar, a integridade referencial não existe no banco de dados e é mantida na aplicação. Se não há documentação, estão em uma estrutura legível? Será preciso fazer um processo de “engenharia reversa” sobre as fontes de dados? Imagine se entre uma das fontes de dados existe por exemplo, um sistema em que as entidades foram geradas por um gerador de aplicação, onde as tabelas e colunas são nomeadas por um prefixo mais um número, e não há qualquer documentação? Você já imaginou o impacto em custo e tempo no projeto se for necessário descobrir toda a estrutura de dados necessária para os objetivos do projeto usando uma ferramenta de profiler? Ou ainda, se a fonte de dados é algo muito antiga e especifica, que não existe um conector conhecido, ou este conector só está disponível numa fermenta cujo custo está nos seis dígitos! Em seção posterior falaremos ainda sobre sistemas sombra, que estão de certa forma relacionados com a vaidade.
66;A indisponibilidade faz parte dos riscos de um sistema em produção, ou seja, que não é mais um projeto. Porém devem ser planejadas na sua construção. A disponibilidade é afetada por falhas em hardware, software, falta de luz, falhas de segurança, problemas físicos ou lógicos de redes entre outros. Deve-se ainda prever e distinguir entre a indisponibilidade prevista e não prevista. Alguns tipos de sistemas podem ser projetados para eventualmente ficarem, de forma programada, fora do ar.
67;Os requisitos de disponibilidade de projetos de B&A variam muito. Um sistema hospitalar pode requer alta disponibilidade, já um sistema de geração de um arquivo de conformidade não. Uma disponibilidade alta, por exemplo, de 90%, significa que o sistema poderá estar indisponível cerca de 36 dias por ano é intolerável até para a aplicação menos critica. Já, uma disponibilidade de 99,999% (Conhecida como cinco noves), representa uma indisponibilidade de 5,26 minutos por ano. Os requisitos de disponibilidade vão afetar drasticamente seu projeto em termos de tempo, infraestrutura, pessoal, fornecedores e mais ainda, em custos. A inclusão de um ou dois noves depois da vírgula na disponibilidade, pode causar um impacto significativo nos custos de seu projeto.
68;Se partes da solução serão contratadas de terceiros, como por exemplo, um BI como serviço, além do SLA, pode ser interessante ter em contratação para projetos críticos o RTO (Recovery Time Objective), em português objetivo de tempo de recuperação, que define, em caso de falha ou desastre, o tempo que contratado tem para recuperar o sistema e colocá-lo de volta em funcionamento.
69;A alta disponibilidade significa sistemas mais tolerantes a falhas, que pode ser implementado por um “simples” Raid 6 ou até envolver redundância de servidores, armazenamentos, redes físicas e lógicas, replicação de dados para servidores remotos entre outros. Do ponto de vista de bancos de dados, os grandes fornecedores de banco de dados (não só relacionais) oferecem soluções de redundância. Certos produtos tem a redundância como característica nativa, como o próprio Hadoop, onde datanodes e namenodes são naturalmente replicados.
70;A virtualização não é nenhuma novidade. Projetos de B&A normalmente tem pelo menos uma de suas camadas virtualizada, o que reduz custos e facilita o gerenciamento. Certas partes de um projeto, obviamente, não fazem sentido serem virtualizadas em um mesmo servidor físico. Por exemplo, datanodes redundantes, se estiverem virtualizados no mesmo hardware, em caso de pane de qualquer elemento deste equipamento, tornará os dados destes nós indisponíveis.
71;A solução de backup que será aplicado ao mesmo, depende diretamente dos requisitos de disponibilidade e segurança do projeto. Podem ser necessários, além de backups completos, backups diferenciais, de configurações, de sistemas de autenticação entre outros. Também, pode ocorrer de que o backup tenha que ser feito numa estrutura física, diferente, ou seja, feito ou levado para outras instalações.  
72;Os requisitos de segurança e privacidade podem afetar muito o projeto, não apenas no que se refere a ferramentas, mas no seu próprio desenvolvimento, por isso devem ser considerados já no início do projeto. Dados podem ter que trafegar ou terem seu armazenamento criptografados. Requisitos funcionais podem existir controle de acesso por linha ou por coluna. Pode ser preciso que ferramentas de front end suportem autenticação integrada com LDAP.
73;A solução a ser projeta e desenvolvida tem requisitos de auditoria de uso e acesso a dados? Certos projetos podem ter requisitos de auditoria de uso, que normalmente vêm associada a questões de segurança e privacidade bastante restritos. A auditoria pode ser necessária em mais de uma etapa: na extração, no staging e na visualização. Normalmente, quando a equipe e ETL tem acesso a dados em uma fonte de origem, este acesso e restrito a certas tabelas e colunas. Uma auditoria vai se certificar que dados das quais não se deveria ter acesso foram extraídos. No staging, a auditoria registra quais dados foram atualizados. Na visualização, normalmente a mais simples, o sistema deve registrar quais fatos ou mesmo painéis foram acessados por quem, quando e de onde.
74;Deve-se avaliar com cuidadosamente as políticas organizacionais de governança de dados. Trata-se de uma serie políticas, processos, pessoas e tecnologia de como os dados devem ser governados na organização. O projeto terá que se adequar a estas policias, não somente quanto ao manuseio dos dados, mas quanto ao uso de sistemas e infraestrutura que serão utilizados.
75;Se a empresa para qual o projeto é executado é uma multinacional, podem haver requisitos de cultura de idioma. Todos sabemos que requisitos de idioma significam: a interface traduzida para o idioma local. Requisitos de cultura requerem elementos como datas e moedas, sejam formatados de acordo com a cultura do país onde a ferramenta é usada.
76;Se o problema é apenas com a interface da ferramenta para o usuário final, uma consulta a documentação e uma provável prova de conceito podem sanar qualquer dúvida a respeito. Mas há um porém: normalmente um objeto de visualizam no front end vai usar um label para uma fato, já nomes de colunas serão exibidos como estão no banco de dados. Pode ser necessário que a ferramenta suporte ainda a tradução de elementos como nomes de dimensões e atributos.
77;Às vezes os requisitos de cultura vão exigir programação ou implementação de fórmulas em medidas. Por exemplo, conversão de valores através de consultas em tempo real a conversão de moedas.
78;Se seu projeto vai usar um produto de uma tecnologia que está no mercado a décadas, você poderá ter algumas preocupações quanto a requisitos técnicos e funcionais, como suporte de volume de dados, failover, backup entre outros. Porém se está nos planos do projeto usar alguma tecnologia mais atual, digamos, com cinco anos ou menos de existência, é preciso tomar mais alguns cuidados. Vamos falar durante a obra da importância de pilotos e protótipos, mas aqui fica um relato de como uma nova tecnologia foi descartada através da implementação de um protótipo. Embora o produto fosse muito bem-conceituado e aparecesse como a nova sensação do mercado para projetos de B&A, na prática apresentou vários problemas sérios: primeiro o produto criava uma centena de processos zumbis, pelo qual parecia que ele perdia o gerenciamento, chegando ao ponto de acabar com a memória do servidor. Não foi encontrada nenhum documento descrevendo como resolver o problema ou mesmo oferecendo um workaround. Na comunidade de usuários também não foi possível encontrar uma única pista. O problema acabou sendo resolvido mas proporcionou um grande atrasado e gerou a desconfiança de todos envolvidos no projeto, que acabou sendo implementado em outra tecnologia. Por isso, quando se tratar de produtos ou tecnologias novas, alguns cuidados podem evitar sérios problemas no projeto.
79;Incialmente avalie o TCO, Total Cost of Ownership, ou custo total de aquisição. Vamos pensar no Hadoop. Você pode avaliar implementar um projeto usando os binários gratuitos da fundação apache, ou optar por uma distribuição de terceiros, como Cloudera, Hortonworks, MapR ou até Microsoft. Os custos destas licenças de terceiros podem ser significativos a partir de um certo número de nós, embora para projetos pequenos existam versões gratuitas. Outros oferecem a gratuidade apenas por um tempo. Porém, para um projeto não devemos apenas avaliar o custo de licenças, mas todos os custos diretos e indiretos envolvidos, que incluem treinamento, infraestrutura, hardware, testes, crescimento, resolução de incidentes e falhas, backups, recuperação entre muitos outros. Deixo claro que não estou advogando para o fato de que se tenha que usar uma versão não Apache original do Hadoop, estou dizendo apenas que todos os custos devem ser considerados.
80;Outro ponto importante é avaliar a documentação e a base de conhecimento produzida sobre o produto. Existem produtos muito bem documentados, outros com documentação extremamente pobre, onde mal há linhas escritas sobre configurações básicas.
81;Também as questões de treinamento. Normalmente será preciso treinar vários grupos de usuários, com vários aspectos diferentes da tecnologia. Existe treinamento disponível? O treinamento é de qualidade e atende os requisitos do produto? Já gerenciei projetos onde o caminho mais fácil foi a própria empresa desenvolver os treinamentos.
82;Também talvez obvio, mas que não podemos deixar de mencionar, é o suporte. Que tipo de suporte será prestado? Quais os canais de suporte? Qual a SLA?
83;Se você vai incorporar um produto open source e pretende alterar seu código, é bom verificar quais os padrões de codificação foram usados, se é que foi usado algum. O código é identado, organizado, legível, documentado? Foram aplicadas as melhores práticas, não apenas de escrita de código mais de arquitetura? Deve-se também avaliar se a empresa quer arcar com o ônus de manter o código fonte de um sistema, às vezes, de proporções gigantescas.
84;Por fim, será feito alguma transferência de tecnologia? De que forma? Quais são as garantias? Quem ficará responsável pelo o que neste processo? No capítulo 9 falaremos mais sobre os processos de aquisições.
85;Shadow Systems, ou sistemas sombra, são aqueles softwares ou planilhas que são usados na empresa de forma não oficial, normalmente em paralelo com sistemas de operações maiores, como ERPs, CRMs e outros. Os motivos da adoção destes tipos de sistemas são muitos, mas o mais comum, é que o sistema oficial não atende determinada funcionalidade na forma que o usuário gostaria, o que é natural, uma vez que sistemas são genéricos, não adaptados para o processo de negócio especifico da empresa onde foram implantados. Sistemas sombra são o pesadelo de muitos CIOs, e, são encontrados em algum canto mesmo em corporações mais rígidas em sua governança de TI. Já silos de dados são bases de dados isoladas e não integradas com o restante da organização. Um silo de dado pode existir as vezes até na forma de um data mart, bem estruturado e com alta entrega de valor. Sistemas sombra são normalmente origens de silos de informação.
86;Entendido o que são, como estes sistemas afetam projetos de B&A? Infelizmente, é muito comum que os requisitos funcionais de projetos envolvam em algum pronto um ou mais sistema sombra, e isso pode se tornar um problema. Este tipo de sistema é quase como algo pirata dentro da organização, as vezes instalados em estações de trabalho. Já vi casos de sistemas de CRM inteiros em notebooks de vendedores que, obviamente, de vez em quando, desconectavam seus equipamentos da rede e saiam em campo. Levando todo o sistema junto (e não era um sistema preparado para sincronizar os dados na volta!). Não há garantia nenhuma para o processo de extração de dados, que a informação estará lá quando necessária. Pior, e bastante comum, são quando estes sistemas são nada mais do que planilhas, cheias de fórmulas, desestruturadas e sobrecarregadas de dados. Nada garante que quando necessário a planilha não vai estar aberta, ou que seja movida de lugar, ou ainda que sua estrutura seja deliberadamente alterada. Em todas estas situações seu processo de carga de dados, obviamente vai falhar.
87;Não podemos simplesmente determinar que sistemas sombra não façam parte do projeto. Mas podemos minimizar os riscos: buscar alternativas para a informação é a primeiro passo. Podemos ainda determinar requisitos mínimos para este tipo de sistema seja incluído no projeto. Se nenhuma dessas hipóteses funcionar, devemos definir políticas mínimas para a manutenção do sistema e minimizar o impacto no projeto. Bloquear estruturas de planilhas e não criar diretivas para que o arquivo não seja movido ou excluído, são algumas. Também, é possível incluir no orçamento do projeto o desenvolvimento de sistemas centralizados para suprir o problema de planilhas.
88;Não é incomum que fatos de negócio estejam em mais de um sistema. Por exemplo, o valor total de horas extras da folha de pagamento do mês pode estar diferente no sistema de folha e na contabilidade. Na reunião com o CEO, o gerente financeiro acha que a meta de redução de horas extras não foi atingida, pois o seu KPI capturou dados do sistema financeiro. Já o gerente de RH, com um relatório com dados oriundos do sistema de folha, garante que meta foi atingida. O cliente pode ter um endereço no sistema financeiro e outro no CRM, que acabou de vender um novo produto e atualizou o endereço. A cobrança da nova compra vai então para o endereço errado. Desde que as funcionalidades do projeto comecem a ser definidas, é importante o gerente do projeto estabelecer e documentar quais serão as origens dos fatos e medidas que farão parte do projeto. Felizmente, empresas que adotam processos de governança de dados, como MDM (Master Data Management), tem este risco minimizado. É claro que, mesmo com um MDM implementado, muita informação não vai ter um representação como registro mestre.
89;Colocar riscos como um dos primeiros capítulos não é por acaso. Projetos de B&A são especialmente sujeitos a riscos. Projetos de TI são por natureza projetos de alto risco. Especificamente, projetos de desenvolvimento de softwares estão entre os mais difíceis em todas as indústrias. Eu me arriscaria a dizer que projetos de B&A são os mais complexos e difíceis em Tecnologia da Informação. Já falamos em falhas de projetos de desenvolvimento de software, mas projetos de tecnologia falham em torno de 25%, enquanto, o índice de falhas de projetos de B&A é o já mencionado índice de 55% Na verdade, projetos de desenvolvimento de software e de B&A tem muito em comum: envolvem o desenvolvimento de algo abstrato e não tangível. Grandes projetos de B&A, como por exemplo, a construção de um data warehouse, têm ainda o fator tempo como inimigo. Diferente da construção de um prédio, em que o cliente consegue ver as paredes sendo construídas, o que o cliente vai ver entregue e que lhe agregue valor ao longo da construção de um data warehouse? Scritpts de extração? Tabelas fato modeladas? Fórmulas de medidas? Portanto, um gerente de projetos de B&A deve ter especial atenção a gestão de riscos durante todas as etapas do projeto.
90;Neste capítulo vamos analisar riscos com ênfase em projetos de B&A. Em seção posterior deste capítulo, vamos comentar sobre os principais riscos que podem estar associados a projetos deste tipo.
91;Qualquer evento está sujeito a algum tipo de incerteza: atravessar a rua, embora pareça uma ação simples, tem suas incertezas, você pode torcer o pé, ser atropelado, cair num buraco, desmaiar etc. O maior risco neste caso sem dúvida é ser atropelado. Por isso, antes de atravessarmos a rua, tomamos algumas medidas visando minimizar o risco de atropelamento: paramos, olhamos para os lados e quando acharmos que estamos seguros, atravessamos a rua. Quando vamos dirigir o carro, colocamos o cinto de segurança. Um voo possui uma série de medidas buscando minimizar riscos: treinamento da tripulação, divulgação de instruções de segurança antes da decolagem entre outros. Alguns passageiros podem tomar medidas pessoais de minimização de riscos antes de uma viagem: fazer orações ou deixar recomendações com parentes caso algo de ruim aconteça. Se na nossa vida tomamos medidas para minimizar riscos, porque não deveríamos toma-las também em projeto, onde há grandes expectativas criadas, dinheiro investido e pessoas empenhadas em criar um produto ou serviço? Assim como as medidas de segurança não impedem que aviões caiam, gerenciamento de riscos não vai garantir que o projeto não fracasse, mas com certeza vão aumentar as chances de sucesso e no mínimo, minimizar o impacto de eventos negativos. O gerenciamento de riscos é uma séria de processos que tem como objetivos principais identificar riscos, analisa-los e responder a eles, eliminando ou minimizando seu impacto no projeto. O gerenciamento de riscos deve ocorrer através de um plano, que deve conter, entre outras coisas, e equipe responsável pela gestão de riscos, a metodologia que será empregada, o orçamento destinado à gestão de riscos, os processos necessários com sua frequência de execução. Existe um consenso entre especialistas que mesmo com uma boa gerencia de riscos, ainda cerca de 10% deles não serão identificados, para os quais o projeto deve ter alocado recursos de contingência.
92;A gestão de riscos como um processo contínuo, deve ocorrer durante todo o projeto. Não adianta identificar riscos apenas no início: novos riscos podem surgir. As fontes de novos riscos podem ser muitas: crises econômicas, mudanças tecnológicas, mudanças em parceiros ou fornecedores. No decorrer do projeto, riscos já identificados podem passar a ter a probabilidade de ocorrência zero, ou seja, deixarem de existir. Da mesma forma, riscos já existentes podem mudar sua probabilidade ou seu impacto, o que, consequentemente, deverá alterar a estratégia que existe para aquele risco. A identificação de riscos ao longo do projeto deve ser um trabalho da equipe do projeto, podendo envolver até mesmo clientes e terceiros. Muitas técnicas podem ser aplicadas, como entrevistas, análise de documentação de projetos anteriores, estudo da WBS, dinâmicas de grupo como Brainstorming e Delphi. O risco identificado não deve ser simplesmente considerado para acompanhamento, é preciso analisa-lo quanto a viabilidade da sua exatidão.
93;Riscos possuem fatores de risco, que são eventos que influenciam de alguma forma o risco. Por exemplo, uma crise econômica pode influenciar positivamente o risco de falta de mão de obra qualificada. O resultado do risco é o que acontece se o risco se efetiva, sem antes ter sido tomada qualquer medida visando minimiza-lo. Atrasar o projeto por falta de mão de obra qualificada é o resultado de um risco. A isso cabe uma reação ao risco: treinar um recurso em determinada tecnologia para minimizar o impacto da falta da mão de obra.
94;Já falamos que o risco é cercado de incerteza, pois pode ou não ocorrer. A efetivação do risco resulta na ocorrência de um problema. Por exemplo, existe o risco de falta de mão de obra qualificada. O projeto iniciou e o risco se materializou: não se conseguiu contratar mão de obra. O risco tornou-se então um problema.
95;Os riscos são divididos em cinco grupos: externos, internos, organizacionais, de negócios e puros. Externos, como devemos imaginar, são externos a organização e ao projeto. Um exemplo de risco externo é por exemplo, uma mudança em alguma legislação que afete o projeto. Interno são os inerentes a organização. Um exemplo clássico e que será abordado ainda neste capítulo, são os riscos relacionados a recursos humanos. Um tipo de risco organizacional são os riscos técnicos, muito presentes em projetos de B&A. Um exemplo seria uma incompatibilidade do extrator com uma fonte de dados. Riscos de negócios são aqueles inerentes a qualquer projeto, como por exemplo uma crise econômica. Por fim, os riscos puros, também chamados de seguráveis, são riscos como incêndios, terremotos, ferimentos etc.
96;Todo o risco possui duas dimensões: probabilidade e impacto. Um risco só é risco se a probabilidade de ocorrer é maior que zero e menor que cem por cento. Se a probabilidade é zero, deixa de ser um risco pois não vai ocorrer nuca. Se a probabilidade é de cem por centro, deixa de ser um risco e passa a ser um problema. Da mesma forma, o impacto em caso de ocorrência deve ser significativo, pois mesmo que a probabilidade seja de 99 por cento e o impacto de ocorrência seja insignificante, deixa de ser um risco relevante.
