ID;FILE
1;Na era da informação e conhecimento, analisar dados não é uma atividade qualquer, para empresas e governos, é uma questão de sobrevivência. Num mundo globalizado e cada vez mais competitivo em que dados eletrônicos são produzidos de forma exponencial, quem for capaz de extrair informação e conhecimento de dados de forma eficiente, venderá mais, produzirá mais, gastará menos, terá clientes mais satisfeitos, fornecedores mais eficientes e estará em conformidade com agências reguladoras e fiscalizadoras. Não somos capazes ainda de avaliar com precisão como essa nova era que está surgindo será, mas sabendo que a produção e análise de dados terão um papel fundamental.
2;E como se extrai informação e conhecimento de dados? Implementando projetos de Big Data. Um projeto, segundo definição do PMBOK (2013) é um esforço temporário para produzir um produto ou serviço exclusivo. Um projeto de Big Data possui estas mesmas características: é um esforço com início e fim, portanto temporário, e produz algo até então inexistente, e, portanto, exclusivo. Embora o esforço seja temporário, o resultado produzido não é. Podemos sim, por exemplo, empreender um projeto de auditoria, que uma vez encerrado, seu resultado é entregue: encerra-se o projeto e o produto criado também chega ao fim. Mas de uma maneira geral, um projeto de Big Data gera um produto ou serviço que vai entrar em seu ciclo de vida útil, gerando resultados por tempo indeterminado. É o que acontece, por exemplo, quando se constrói um armazém de dados. A construção é um projeto, como escopo, custos e tempo definidos. Quando pronto, o projeto termina, mas o armazém continua sendo carregado com dados históricos e gerando informação e conhecimento relevantes para a tomada de decisão.
3;Tudo isso para dizer que, de uma maneira geral, um projeto de Big Data nada mais é do que um projeto qualquer, com início e fim, escopo, orçamento, cronograma entre outros. Então porque uma obra especifica para tratar destes projetos? Porque este tipo de projeto está entre os mais complexos e com maiores riscos de todas as indústrias. Anteriormente comentamos que, semelhante a produção de software, projetos de Big Data produzem algo abstrato, não tangível, de extrema complexidade no sentido de poder envolver muitas estruturas, sistemas, formatos, pessoas e infraestrutura.
4;Nesta obra vamos usar alguns termos que precisamos definir antes, de forma há não haver um entendimento ambíguo do seu significado:
5;Projeto de análise de dados ou de Big Data: Nesta obra vamos usar projetos de análise de dados ou de Big Data como uma definição genérica para qualquer tipo de projeto que envolva extrair informação e conhecimento de dados: analisar dados pode ser produzir um relatório, construir um data mart, analisar sentimentos em redes sociais, criar um modelo para uma análise preditiva, capturar dados de sensores para avaliar a saúde dos equipamentos na linha de produção, classificar pentabytes de documentos jurídicos  ou simplesmente rodar uma consulta para ordenar as vendas no mês. De uma maneira genérica, vamos nos referir a projetos de Big Data e Análise de Dados como B&A. Quando a referência ao longo da obra não for genérica, usaremos um termo mais especifico, como por exemplo analise preditivas.
6;Dados de origem: analisar dados requer coletar dados de algum lugar. Vamos usar dados de origem para nos referirmos a dados ou conjuntos de dados que são utilizados para popular um modelo, ser carregado num processo de extração e transformação, ser ordenado em uma planilha eletrônica ou mesmo sobre o qual se executa uma consulta SQL.
7;Dados de Staging: Muitos processos de analises de dados possuem uma etapa intermediária, entre os dados de origem e o resultado dos dados já consolidados. Esta etapa intermediária serve para que os dados sejam transformados, somados, resumidos, juntados ou calculados. O termo staging na obra se refere a qualquer processo intermediário, não apenas aquele conhecido num processo de construção de um data warehouse tradicional.
8;Dados de destino: aqui estaremos sempre nos referindo ao resultado: o cubo, a previsão de uma análise preditiva, o relatório, o arquivo gerado, entre outros.
9;O PMBOK nos ensina que nem todos os seus processos são obrigatórios. Tampouco temos que aplicar os processos sempre com a mesma intensidade. Quais processos usar e em qual intensidade depende das decisões tomadas pelo gerente do projeto junto a sua equipe, e deve estar diretamente relacionada a fatores como: complexidade do projeto, elementos novos relacionados a pessoas, tecnologias ou dados de origem.
10;Se você está lendo esta obra provavelmente já ouviu e leu muito sobre Big Data, e não será nosso objetivo aqui apresentar este conceito. Porém, muitos entendimentos são ambíguos. Criou-se quase uma relação obrigatória entre Big Data e tecnologias de MapReduce como Hadoop. No mínimo, se associa o termo a grandes volumes de dados, pentabytes ou mais, ignorando-se todos os demais “Vs” (velocidade, volume, variedade, veracidade e valor). Nesta obra vamos ter uma definição mais abrangente para projetos de B&A (Big Data e Análise de Dados). Se o projeto envolve uma única fonte de dados relacional para produzir dimensões em um data mart, não podemos considerar Big Data, mas em outras hipóteses, em que existem muitas de fontes de dados, ou algumas poucas, mas com pelo menos uma não estrutura, ou mesmo dados semiestruturados ou fontes de dados NoSQL, ou até mesmo, claro, volumes de dados além de um projeto tradicional, então sim, todos estes serão considerados projetos de Big Data.
11;Falamos em seção anterior mas vamos repetir: cabe ao gerente de projeto decidir quais processos e com qual intensidade eles serão aplicados, conforme a complexidade do projeto. Da mesma forma, todas as recomendações e técnicas apresentadas nesta obra, especificas para a análise de dados, devem ser avaliadas pelo gerente e sua equipe se devem ser aplicadas e com qual intensidade. Por exemplo, vamos falar da criação de protótipos ao longo da obra. Um determinado projeto com baixa complexidade, do qual já se tenha experiência prévia, tecnologia madura e testada, talvez dispense tolamente um protótipo. Já um outro projeto de média complexidade que terá uma entrega artefatos de visualização, pode ter protótipos gerados em uma ferramenta de maquetes para simular telas. Finalmente, um grande projeto de longo prazo e grande complexidade, pode requerer que um protótipo funcional seja gerado para verificar a viabilidade e minimizar riscos.
12;Desde a pré-história o homem analisa dados. A análise de dados eletrônicos é um evento mais recente, com pouco mais de 70 anos. A capacidade de usar um computador para analisar dados vem mudando o mundo. Vamos pensar em um exemplo simples: auditar folha de pagamento. Tradicionalmente, a auditoria teria que ser manual, por amostragem, e mesmo assim poderia levar semanas. Com o computador, o processo passou a ser totalmente eletrônico, a prova de erros, milhões de vezes mais rápido e de forma contínua.
13;Mas a análise de dados só começou a tomar força na década de 90, foi quando os grandes armazéns de dados, ou data warehouse começaram a se tornar mais comuns para apoiar as empresas a tomarem decisões. De lá para cá, armazéns de dados se popularizaram, encontrados em praticamente qualquer grande empresa.
14;Mas o que diferencia um projeto de análise de dados tradicional, como os popularizados nos anos 90, de um projeto de Big Data? Primeiro, os “Vs” que falamos na seção anterior: de velocidade, volume, variedade, veracidade e valor. Veracidade e valor já eram características de projetos tradicionais de análise de dados. Vamos entender o que os outros três “Vs” representam em relação a projetos tradicionais:
15;Velocidade: a velocidade diz respeito não somente a da produção do dado em si, mas a velocidade do processamento e produção de informação e conhecimento, visto que o valor da informação é inversamente proporcional ao tempo em que ocorreu o evento que gerou o dado. Por exemplo, ocorreu uma falha em um equipamento. O operador recebe o alerta 5 segundos depois da falha: ele desliga o equipamento, identifica a falha, aperta o colar de suporte vibratório e a linha de produção volta a produzir em 10 minutos. Porém, imaginando outro cenário, se ele recebe o alerta em 10 segundos: a máquina tem que ser desmontada para troca do colar de suporte vibratório, e a linha de produção para por 2 horas. Mas se por algum problema ele só recebe o alerta em 30 segundos: o colar de suporte vibratório se rompe e causa um estrago em série na máquina. O equipamento deve ser substituído, seu custo de reparação será na casa dos 6 dígitos e a linha de produção tem que parar por 6 horas, causando um prejuízo de centenas de milhares de reais. O gráfico da Figura 1‑1 abaixo mostra a relação inversa entre tempo e valor da informação. Toda a informação chegará a um tempo em que seu valor é zero, isso pode ocorrer após alguns segundos ou até mesmo depois de centenas de anos. É preciso deixar claro que estamos falando de valor da informação, e não do dado: no exemplo acima, quando o dado é extraído do equipamento, ele ainda não tem valor. Só depois que é processado ele passa a ser informação e ter valor.
16;Volume: projetos tradicionais eram construídos em armazéns de dados contendo por volta de terabytes de dados. Projetos de Big Data são de petabytes ou mais.
17;Variedade: projetos tracionais carregavam dados estruturados de sistemas de operação tradicionais, em modelos relacionais, hierárquicos ou de rede. Projetos de Big Data processam estes tipos de dados, que na verdade ainda são a maioria, mas também incluem dados não estruturados e semiestruturados de redes sociais, sensores, web, documentos, e-mails etc.
18;Mas além dos “Vs” existem outras diferenças significativas que devem ser consideradas em projetos de B&A. Vamos ver alguns:
19;Primeiro, do ponto de vista de arquitetura: projetos tradicionais tem uma arquitetura centralizada, enquanto Big Data é distribuída. Se o projeto tradicional precisar crescer, este crescimento é feito de forma vertical: se adiciona mais memória, poder de processamento e armazenamento ao servidor. Projetos de Big Data crescem horizontalmente, em vez de um “upgrade” no servidor, novos nodos, como data nodes ou name nodes, são adicionados à estrutura de B&A, geralmente virtualizados. Projetos tradicionais trafegam mais dados do servidor para o cliente ou do servidor para fora da empresa. Em projetos de Big Data o maior trafego é entre os nós dos servidores: entre data nodes, entre nomes nodes e data notes etc.
20;Em projetos tradicionais, existe uma grande preocupação em só carregar dados em que, a partir de uma análise prévia, se vê valor. Estes dados são tratados e carregados em repositórios pequenos (para os padrões de Big Data) para apoiar decisões. Por outro lado, projetos de Big Data carregam grandes volumes de dados em um sistema de arquivo como o HDFS, em seu formato nativo, mesmo que em princípio não se enxergue valor. Estes dados formam os conhecidos data lakes, ou lagos de dados. Posteriormente, parte destes dados podem ser transformados e carregados em um data mart tradicional.
21;Outra forma que podemos olhar uma solução de Big Data é sob sua arquitetura básica. Neste contexto, temos quatro elementos: fontes de dados, carga, armazenamento, analise e visualização (ou apresentação). Neste aspecto, em uma solução de análise de dados clássica estão presentes estes mesmos elementos de arquitetura, o que muda, são algumas particularidades em alguns elementos. Vamos entender melhor.
22;Quantos as fontes de dados, podemos ter nos dois casos os mesmos elementos: dados estruturados ou não estruturados. Porém, projetos de Big Data tem mais presentes fontes de dados não estruturadas, como já estudamos no quesito variedade. Na carga, também temos elementos semelhantes nos dois casos: a carga pode ser feita por um processo de carga, um web service ou mesmo uma API. No armazenamento começam as diferenças. Um projeto tradicional armazena dados em um banco de dados relacional ou dimensional, enquanto projetos de Big Data armazenam dados em sistemas de arquivos distribuídos com HDFS e bancos de dados NoSQL. Na etapa de análise, em que o objetivo é transformar dados em informação, também há alguma semelhança entre projetos tradicionais e de Big Data: em comum, pode-se usar consultas com uma linguagem estruturada (Pig Latin ou SQL) ou um algoritmo de aprendizado de máquina. Já projetos tradicionais usam cubos, enquanto Big Data usa map reduce. Na visualização temos novamente os mesmos elementos: painéis, relatórios, KPIs entre outros.
23;Projetos de B&A não são criados para analisar dados, configurar clusters, contratar consultores, ou programar scripts: estes elementos são meios para chegar ao objetivo do projeto: responder perguntas. B&A são altamente complexos e envolvem um grande número de variáveis. Se pudemos agrupar estes elementos em grupos, eles seriam quatro, citados aqui em ordem decrescente de importância: pessoas, processos, dados e tecnologia.
24;As pessoas são sem dúvida o elemento mais importante. Projetos de B&A são feitos por pessoas para pessoas, elas estarão sempre envolvidas no processo: produzem os dados de origem, configuram os sistemas de processamento, programam os scripts, definem as regras de negócios, fornecem suporte, interpretam a legislação, geram os relatórios, parametrizam os KPIs, definem os requisitos técnicos e funcionais das soluções entre outros. A gestão de pessoas nestes projetos são tão ou mais importantes do que em outros projetos de tecnologia da informação.
25;Depois, temos os processos de negócio. Estes processos que vão definir os requisitos funcionais do projeto. Eles podem vir de pessoas, de normas internas, de necessidade gerenciais, de legislação, de conformidade ou de regras de mercado.
26;Temos então o dado, que é a matéria prima essencial. Poderíamos fazer uma analogia de um projeto de B&A com uma máquina em uma linha de produção. De um lado, entram dados. Estes dados vão entrar incompletos, inconsistentes, imprecisos e inexatos. O primeiro processo desta linha de produção é trata-los, deixando-os com a qualidade mínima para os objetivos do projeto. Além disso, os dados podem ter suas estruturas modificadas de diversas formas. O dado ainda será processado por um algum algoritmo, com uma função matemática, estatística ou de álgebra relacional, a fim de chegar ao seu formato de onde o usuário seja capaz de extrair informação e conhecimento.
27;Por fim, tecnologia: projetos de dados estão cercados de tecnologia: conectores, softwares de extração, softwares de transformação, softwares de qualidade de dados, algoritmos de aprendizado de máquina, software de visualização, discos rígidos, clusters, roteadores, switches etc.
28;Do ponto de vista de tipo de negócio, um projeto de Big Data pode ser classificado de duas formas: o que busca trazer uma vantagem competitiva, ou aquele que cria um produto ou serviço de dados. Buscar uma vantagem competitiva é resolver um problema de negócio, os clássicos vender mais, gastar menos, ser mais eficiente. Um produto ou serviço é oferecer algo em forma de valorizar dados: um mecanismo de buscas, um serviço de previsão de preços de passagens áreas, um BI self-service entre outros.
29;A segunda forma de classificação destes projetos é quanto aos objetivos, vejamos alguns:
30;Negócios: é o tipo mais comum, buscam melhor eficiência e eficácia de negócios: os já mencionados vender mais, produzir mais, perder menos.
31;Auditoria: buscam encontrar fraudes, desperdícios e erros. Pode ser uma iniciativa interna ou externa da organização.
32;Conformidade: projetos para atender alguma norma de conformidade. A conformidade está associada a alguma entidade reguladora ou fiscalizadora sob a qual a empresa está inserida. Alguns tipos de conformidade, com os referentes ao eSocial brasileiro, requerem a produção de dados ao invés de artefatos de visualização, em outras palavras, estes tipos de projetos geram arquivos produzidos em um layout pré-definido ao invés de um relatório ou um KPI. Um outro exemplo é a seção 404 da Sarbanes-Oxley Act. O Sarbanes-Oxley Act se aplica a empresas que tenham ações registradas na SEC (Securities and Exchange Comission) dos Estados Unidos. Este ato determina que uma serie de controles e procedimentos financeiros, incluindo relatórios, sejam produzidos e mantidos.
33;Operação: atende requisitos operacionais, como por exemplo controle de linha de produção, CEP (Controle Estatístico de Processos), monitoramento de sistemas de informação, controle de tráfego, entre outros.
34;Pesquisa: qualquer projeto de pesquisa em áreas como medicina, biologia ou até mesmo busca de vida extraterrestre. Um exemplo é o projeto GIMPS (Great Internet Mersenne Prime Search), que busca números primos de Mersenne. É o maior projeto de computação distribuida do mundo. Neste projeto, qualquer pessoa ou organização pode baixar um software específico que usa o tempo ocioso de processamento do computador, para busccar números primos. Existem muitos projetos de computação distribuida e colaborativa no mundo, buscando cura para doenças, modelos climáticos entre outros.
35;São várias os tipos de análise que projetos de B&A podem realizar. Alguns projetos podem inclusive, utilizar vários tipos. Por exemplo, é normal em projetos de análise preditiva iniciar com uma análise exploratória. Vamos ver os principais tipos:
36;Descritivos ou Exploratórios: buscam analisar os dados para conhece-los ou apresentar resultados consolidados, como vendas por tipo de produto ou funcionários por departamento. É fortemente baseada em visualização, produzindo gráficos como dispersão, diagrama de caixa, setores, barras entre outros.
37;Inferência: tem como objetivo apresentar prováveis fatos a partir de uma parte menor da população dos dados. Este tipo de análise é apresentado junto com uma margem de erro.
38;Analíticos: busca relações entre dados. Por exemplo, relação de vendas com o sexo do cliente, ou absentismo de acordo como cargo do funcionário.
39;Preditivos: buscam prever fatos futuros. Tem como base fatos ocorridos no passado. Também funcionam com uma margem de erro na previsão. As aplicações em análise preditivas são muitas: prever que será bom pagador, qual aluno terá melhor desempenho, quanto tempo o funcionário ficará na empresa etc.
40;Prescritivos: se o preditivo permite prever o fatoro, a prescritiva traz informações que permite mudar um evento futuro. Por exemplo, na seção anterior o objetivo era prever quanto tempo o funcionário ficará na empresa, mas uma análise prescritiva pode dizer o que deve ser feito para reter o funcionário na empresa.
41;A classificação quanto as fontes de dados também podem ser muito diversas. Primeiro podemos olhar a fonte quanto ao modelo: relacional, rede, hierárquico, orientado a objetos, chave-valor, dimensional etc. Quanto ao fornecedor: Oracle, IBM, Microsoft, Apache etc. Quanto a origem: sistemas de produção, mídias sociais, pesquisas, benchmarking, sensores etc. Por fim, os dados podem ser estruturados, não estruturados e semiestruturados. Vamos entender melhor esta classificação:
42;Estruturados: são dados organizados em linhas em colunas, como em planilhas e banco de dados relacionais. Sua estrutura é fixa e rígida: uma tabela de fornecedores, de produtos ou mesmo de clientes são exemplos.
43;Semiestruturados: nesta modelo, existe uma definição de estrutura, mas ela não é homogenia e não é fixa. Exemplos são arquivos XML e Json.
44;Não estruturados: são dados sem qualquer tipo de estrutura definida: documentos, e-mails, sites etc.
45;Já estudamos que projetos de B&A são, acima de tudo, projetos como quaisquer outros no sentido de que precisam de planejamento e controle. Porém normalmente são mais complexos e com maior risco. Mas o que diferencia o gerente de projetos tradicionais do de projetos de B&A? Coloco aqui alguns pontos que considero importantes: 
46;Experiência em projeto de B&A: estamos falando de projetos complexos e difíceis. Por mais que o gerente de projetos tenha anos de experiência em outras industrias, é fundamental que grandes projetos sejam gerenciados por pessoas com experiência neste tipo de projeto. Você pode estar se perguntando, mas como adquirir experiência? Começando com projetos pequenos e de baixa complexidade ou atuando com algum gerente de projeto já experiente.
47;Gestão de Equipe: um projeto de B&A envolve equipes multifuncionais, com habilidades e experiências diversificadas. O gerente de projeto deve ser capaz de buscar e reconhecer competências, garantir que os recursos recebam os treinamentos necessários, manter a equipe motivada e garantir que cada membro da equipe de o melhor de sua capacidade em busca dos objetivos do projeto.
48;Entendidos conceitos e premissas fundamentais em B&A, neste capítulo vamos analisar alguns fatores importantes que o gerente de projetos e sua equipe devem observar antes ou durante a execução do projeto. Estes elementos estão intimamente relacionados com o capítulo seguinte: riscos, pois, muitos dos fatores aqui apresentados, se forem ignorados, certamente aumentarão os riscos do projeto.
49;Não é função do gerente de projetos criar o Business Case que vai justificar o projeto: normalmente ele vai receber este documento pronto, já amplamente discutido, analisado e aprovado. Caberia ao gerente de projetos apenas acatar o plano e implementa-lo. Mas as coisas podem não ir muito bem se simplesmente “fecharmos os olhos” e seguirmos em frente.
50;Um projeto qualquer deve entregar valor. Um projeto de B&A, como qualquer outro, deve entregar valor. Não é porque o projeto tem um Business Case bem elaborado, discutido e aprovado, que a geração de valor estará garantida (embora teoricamente deveria estar). Você, como gestor do projeto, quer ter em seu currículo um projeto que seja um sucesso em cumprir cronogramas, prazos e custos e que atendeu a definição de pronto, mas que que não entregou valor? Que depois, ou logo depois que entrou em produção é abandonado? Ou que nem chegou a entrar em produção, pois a entrega de valor simplesmente deixou de existir ou ser relevante? Claro que todo gerente de projetos tem que lidar, uma hora ou outra, com projetos que fracassam, pelos mais diversos motivos. Mas não é algo que acontece pelas circunstancias, não por omissão.
51;Infelizmente, é comum projetos de B&A serem produzidos com pouca ou nenhuma utilidade prática. Um gerente funcional que elabora um projeto com questões meramente operacionais, quando seu setor está indo para o buraco e ele não tem qualquer dado para apoia a decisão, um auditor que quer gerar um arquivo para uma norma de conformidade que vai mudar e ser adiada dezenas de vezes antes de ser obrigatória, um executivo que quer um relatório para atender uma questão pessoal, o CIO que ouviu falar de uma nova tecnologia e quer ter aquilo em seu currículo, entre muitos outros casos.
52;Um projeto de B&A não é uma brincadeira. Envolve muitos recursos financeiros e humanos, tempo, e põe em risco a reputação de pessoas. Normalmente um projeto é aprovado em detrimento de outro, que poderia ser mais importante e de fato entregar valor. Por isso, antes de mais nada, o gerente de projetos deve analisar e garantir que o projeto entregue, de fato, valor para a organização.
53;Garantido que o projeto entregará valor, como gerentes de projetos é nosso dever também ter claro quais são os critérios que definem o sucesso de projeto. Sem critérios claros de sucesso definidos, o projeto poderá entrar numa eterna discussão de que se foi bem-sucedido ou não, pois esta passará a ser uma questão subjetiva e pessoal.
54;Já sabemos que não basta o projeto ser entregue em tempo, prazo e custo, aliás, é muito comum um ou mais destes três elementos falharem e mesmo assim o projeto ser considerado um sucesso.
55;Os critérios de sucesso devem ser definidos como patrocinador e usuários chave, todos devem concordar com os mesmos e estes devem ser documentados. Os critérios de sucesso em projetos de B&A podem ser os mais diversos, vejamos alguns dos mais comuns:
56;Normalmente mais de um critério de sucesso é definido. Estes critérios devem ser mensuráveis para serem avaliados. Por exemplo, 70% dos usuários satisfeitos, redução de fraudes em 1%, redução de custo operacional de 0,5%.
57;Os critérios de sucesso não devem ser confundidos com a definição de pronto. A definição de pronto é quando o projeto termina de ser implementado, devendo ser aceito e entregue, dentro dos critérios estabelecidos de escopo, performance e qualidade.
58;Na seção anterior falamos de critérios de sucesso, eles são usados para medir se o projeto foi bem-sucedido. Nesta seção vamos falar de fatores de sucesso, que são pontos específicos que devem ser analisados para aumentar as chances de sucesso do projeto. Então, para ficar claro, critérios são métricas aplicadas quando o projeto está pronto, fatores são pontos que o gerente de projeto e sua equipe devem observar para aumentar as chances de o projeto ser bem-sucedido. Vamos ver alguns fatores de sucesso de projetos de B&A:
